{
  "schemaVersion": "1.0.0",
  "name": "node-cpanel",
  "displayName": "Add or adapt a cPanel Node runtime",
  "version": "0.4.1",
  "description": "Source-traced Node startup, routing, environment, provider and recovery implementation kit.",
  "category": "runtime",
  "maturity": [
    1,
    2,
    3
  ],
  "projectTypes": [
    "web-app",
    "service"
  ],
  "coreCompatibility": ">=0.6.0-alpha.2 <0.7.0",
  "source": {
    "repository": "https://github.com/dondsp/kontextstack",
    "ref": "module/node-cpanel/v0.4.1",
    "path": "modules/node-cpanel",
    "integrity": "sha256-894fb85300b0eb244d9ae0b5384394c1fe62d88748d811322178046b3828dc17"
  },
  "dependencies": [],
  "optionalDependencies": [
    "domain-cpanel@>=0.2.0",
    "static-site-cpanel@>=0.2.0"
  ],
  "conflicts": [],
  "capabilities": [
    "docs",
    "templates",
    "validation"
  ],
  "permissions": {
    "network": false,
    "commands": [],
    "writePatterns": [
      ".kontextstack/modules/node-cpanel/decision.json",
      ".kontextstack/modules/node-cpanel/evidence.json",
      ".kontextstack/modules/node-cpanel/implementation.json",
      ".kontextstack/modules/node-cpanel/kit/checks/browser.md",
      ".kontextstack/modules/node-cpanel/kit/checks/runtime.test.mjs",
      ".kontextstack/modules/node-cpanel/kit/fixtures/public/index.html",
      ".kontextstack/modules/node-cpanel/kit/fixtures/public/site.css",
      ".kontextstack/modules/node-cpanel/kit/snippets/framework-adaptation.md",
      ".kontextstack/modules/node-cpanel/kit/templates/environment-names.json",
      ".kontextstack/modules/node-cpanel/kit/templates/runtime-artifact.json",
      ".kontextstack/modules/node-cpanel/kit/templates/runtime.mjs",
      ".kontextstack/modules/node-cpanel/kit/templates/start.cjs",
      ".kontextstack/modules/node-cpanel/runtime.json",
      "docs/kontextstack/modules/node-cpanel/CODEX_PROMPT.md",
      "docs/kontextstack/modules/node-cpanel/IMPLEMENTATION.md",
      "docs/kontextstack/modules/node-cpanel/PROVIDER_SETUP.md",
      "docs/kontextstack/modules/node-cpanel/ROLLBACK.md",
      "docs/kontextstack/modules/node-cpanel/RUNBOOK.md",
      "docs/kontextstack/modules/node-cpanel/START_HERE.md",
      "docs/kontextstack/modules/node-cpanel/VERIFICATION.md"
    ]
  },
  "files": [
    {
      "path": ".kontextstack/modules/node-cpanel/decision.json",
      "source": "files/.kontextstack/modules/node-cpanel/decision.json"
    },
    {
      "path": ".kontextstack/modules/node-cpanel/evidence.json",
      "source": "files/.kontextstack/modules/node-cpanel/evidence.json"
    },
    {
      "path": ".kontextstack/modules/node-cpanel/implementation.json",
      "source": "files/.kontextstack/modules/node-cpanel/implementation.json"
    },
    {
      "path": ".kontextstack/modules/node-cpanel/kit/checks/browser.md",
      "source": "files/.kontextstack/modules/node-cpanel/kit/checks/browser.md"
    },
    {
      "path": ".kontextstack/modules/node-cpanel/kit/checks/runtime.test.mjs",
      "source": "files/.kontextstack/modules/node-cpanel/kit/checks/runtime.test.mjs"
    },
    {
      "path": ".kontextstack/modules/node-cpanel/kit/fixtures/public/index.html",
      "source": "files/.kontextstack/modules/node-cpanel/kit/fixtures/public/index.html"
    },
    {
      "path": ".kontextstack/modules/node-cpanel/kit/fixtures/public/site.css",
      "source": "files/.kontextstack/modules/node-cpanel/kit/fixtures/public/site.css"
    },
    {
      "path": ".kontextstack/modules/node-cpanel/kit/snippets/framework-adaptation.md",
      "source": "files/.kontextstack/modules/node-cpanel/kit/snippets/framework-adaptation.md"
    },
    {
      "path": ".kontextstack/modules/node-cpanel/kit/templates/environment-names.json",
      "source": "files/.kontextstack/modules/node-cpanel/kit/templates/environment-names.json"
    },
    {
      "path": ".kontextstack/modules/node-cpanel/kit/templates/runtime-artifact.json",
      "source": "files/.kontextstack/modules/node-cpanel/kit/templates/runtime-artifact.json"
    },
    {
      "path": ".kontextstack/modules/node-cpanel/kit/templates/runtime.mjs",
      "source": "files/.kontextstack/modules/node-cpanel/kit/templates/runtime.mjs"
    },
    {
      "path": ".kontextstack/modules/node-cpanel/kit/templates/start.cjs",
      "source": "files/.kontextstack/modules/node-cpanel/kit/templates/start.cjs"
    },
    {
      "path": ".kontextstack/modules/node-cpanel/runtime.json",
      "source": "files/.kontextstack/modules/node-cpanel/runtime.json"
    },
    {
      "path": "docs/kontextstack/modules/node-cpanel/CODEX_PROMPT.md",
      "source": "files/docs/kontextstack/modules/node-cpanel/CODEX_PROMPT.md"
    },
    {
      "path": "docs/kontextstack/modules/node-cpanel/IMPLEMENTATION.md",
      "source": "files/docs/kontextstack/modules/node-cpanel/IMPLEMENTATION.md"
    },
    {
      "path": "docs/kontextstack/modules/node-cpanel/PROVIDER_SETUP.md",
      "source": "files/docs/kontextstack/modules/node-cpanel/PROVIDER_SETUP.md"
    },
    {
      "path": "docs/kontextstack/modules/node-cpanel/ROLLBACK.md",
      "source": "files/docs/kontextstack/modules/node-cpanel/ROLLBACK.md"
    },
    {
      "path": "docs/kontextstack/modules/node-cpanel/RUNBOOK.md",
      "source": "files/docs/kontextstack/modules/node-cpanel/RUNBOOK.md"
    },
    {
      "path": "docs/kontextstack/modules/node-cpanel/START_HERE.md",
      "source": "files/docs/kontextstack/modules/node-cpanel/START_HERE.md"
    },
    {
      "path": "docs/kontextstack/modules/node-cpanel/VERIFICATION.md",
      "source": "files/docs/kontextstack/modules/node-cpanel/VERIFICATION.md"
    }
  ],
  "validations": [
    {
      "id": "runtime-contract-readable",
      "kind": "json-readable",
      "path": ".kontextstack/modules/node-cpanel/runtime.json"
    },
    {
      "id": "canonical-source-present",
      "kind": "contains",
      "path": "docs/kontextstack/modules/node-cpanel/RUNBOOK.md",
      "value": "https://github.com/dondsp/kontextstack"
    }
  ],
  "upgrade": {
    "from": [
      "0.3.0",
      "0.4.0"
    ],
    "strategy": "preview-required"
  },
  "contracts": {
    "schemaVersion": "kontextstack-kit/v1",
    "implementation": ".kontextstack/modules/node-cpanel/implementation.json",
    "guide": "guide.json"
  }
}
