{
  "schemaVersion": "1.0.0",
  "name": "auth-google",
  "displayName": "Google Authentication Adapter Plan",
  "version": "0.4.0",
  "description": "Optional Google identity, consent, account-linking, callback, scope, storage, and revocation planning.",
  "category": "identity",
  "maturity": [2, 3],
  "projectTypes": ["web-app"],
  "coreCompatibility": ">=0.4.0 <0.6.0",
  "source": {
    "repository": "https://github.com/dondsp/kontextstack",
    "ref": "module/auth-google/v0.4.0",
    "path": "modules/auth-google",
    "integrity": "sha256-4566b6567fe98d1235efcd4b1324ee9ed4db65b3ebec8fbae71b2a01d02767ed"
  },
  "dependencies": ["auth-local@>=0.4.0"],
  "optionalDependencies": [],
  "conflicts": [],
  "capabilities": ["docs", "templates", "validation"],
  "permissions": {
    "network": false,
    "commands": [],
    "writePatterns": [
      ".kontextstack/modules/auth-google/provider.json",
      "docs/kontextstack/modules/auth-google/RUNBOOK.md"
    ]
  },
  "files": [
    {
      "path": ".kontextstack/modules/auth-google/provider.json",
      "source": "files/.kontextstack/modules/auth-google/provider.json"
    },
    {
      "path": "docs/kontextstack/modules/auth-google/RUNBOOK.md",
      "source": "files/docs/kontextstack/modules/auth-google/RUNBOOK.md"
    }
  ],
  "validations": [
    {
      "id": "provider-contract-readable",
      "kind": "json-readable",
      "path": ".kontextstack/modules/auth-google/provider.json"
    },
    {
      "id": "canonical-source-present",
      "kind": "contains",
      "path": "docs/kontextstack/modules/auth-google/RUNBOOK.md",
      "value": "https://github.com/dondsp/kontextstack"
    }
  ],
  "upgrade": {
    "from": [],
    "strategy": "preview-required"
  }
}
