{
  "schemaVersion": "1.0.0",
  "name": "auth-local",
  "displayName": "Local Authentication Foundation",
  "version": "0.4.0",
  "description": "Local account, session, CSRF, RBAC, registration, recovery, audit, and acceptance planning.",
  "category": "identity",
  "maturity": [2, 3],
  "projectTypes": ["web-app"],
  "coreCompatibility": ">=0.4.0 <0.6.0",
  "source": {
    "repository": "https://github.com/dondsp/kontextstack",
    "ref": "module/auth-local/v0.4.0",
    "path": "modules/auth-local",
    "integrity": "sha256-09b56e3686b7f2f48821ac9c3b54900d32858d52a3e51fea364aabdfeb81ddd8"
  },
  "dependencies": ["mysql-storage@>=0.4.0"],
  "optionalDependencies": ["node-cpanel@>=0.3.0"],
  "conflicts": [],
  "capabilities": ["docs", "templates", "validation"],
  "permissions": {
    "network": false,
    "commands": [],
    "writePatterns": [
      ".kontextstack/modules/auth-local/identity.json",
      "docs/kontextstack/modules/auth-local/RUNBOOK.md"
    ]
  },
  "files": [
    {
      "path": ".kontextstack/modules/auth-local/identity.json",
      "source": "files/.kontextstack/modules/auth-local/identity.json"
    },
    {
      "path": "docs/kontextstack/modules/auth-local/RUNBOOK.md",
      "source": "files/docs/kontextstack/modules/auth-local/RUNBOOK.md"
    }
  ],
  "validations": [
    {
      "id": "identity-contract-readable",
      "kind": "json-readable",
      "path": ".kontextstack/modules/auth-local/identity.json"
    },
    {
      "id": "canonical-source-present",
      "kind": "contains",
      "path": "docs/kontextstack/modules/auth-local/RUNBOOK.md",
      "value": "https://github.com/dondsp/kontextstack"
    }
  ],
  "upgrade": {
    "from": [],
    "strategy": "preview-required"
  }
}
